### ISSUE TITLE
Подскажите настройки обход DPI

### ISSUE THREAD

**Issue by foxy544** [amnezia-vpn/amnezia-wg#47]
Настроил сервер , AmneziaWG все  работает  идеально пока , телефон android не переключатся на мобильный интернет там все заблокировано DPI менял порт на 66 , сервер 195.123.xxx.xxx
от мобильного приходит 5 пакетов и тишина. провайдер Миринда. из vpn остался Vless c XTLS-Reality
`21:01:08.353576 IP 2.63.177.241.56726 > 195.123.xxx.xxx.66: UDP, length 394
21:01:08.415032 IP 2.63.177.241.56726 > 195.123.xxx.xxx.66: UDP, length 435
21:01:08.447786 IP 2.63.177.241.56726 > 195.123.xxx.xxx.66: UDP, length 328
21:01:08.515954 IP 2.63.177.241.56726 > 195.123.xxx.xxx.66: UDP, length 384
21:01:08.641490 IP 2.63.177.241.56726 > 195.123.xxx.xxx.66: UDP, length 425`
